<?xml version='1.0' encoding="UTF-8"?>
<schedule
        xsi:noNamespaceSchemaLocation="../../schedule.xsd" totalPreference="54" xmlns:xsi="http://www.w3.org/2001/XMLSchema-instance">
    <viva student="Student 003" title="Title 3" start="2024-05-28T09:00:00" end="2024-05-28T10:30:00" preference="4">
        <president name="Teacher 001"/>
        <advisor name="Teacher 002"/>
        <coadvisor name="Teacher 003"/>
        <supervisor name="External 002"/>
    </viva>
    <viva student="Student 004" title="Title 4" start="2024-05-28T10:30:00" end="2024-05-28T12:00:00" preference="3">
        <president name="Teacher 002"/>
        <advisor name="Teacher 001"/>
        <supervisor name="External 003"/>
    </viva>
    <viva student="Student 002" title="Title 2" start="2024-05-30T10:30:00" end="2024-05-30T12:00:00" preference="13">
        <president name="Teacher 001"/>
        <advisor name="Teacher 002"/>
        <coadvisor name="Teacher 003"/>
        <supervisor name="External 001"/>
    </viva>
    <viva student="Student 001" title="Title 1" start="2024-05-31T15:30:00" end="2024-05-31T17:00:00" preference="15">
        <president name="Teacher 001"/>
        <advisor name="Teacher 003"/>
        <supervisor name="External 001"/>
        <supervisor name="External 002"/>
    </viva>
    <viva student="Student 005" title="Title 5" start="2024-06-02T09:00:00" end="2024-06-02T10:30:00" preference="7">
        <president name="Teacher 003"/>
        <advisor name="Teacher 001"/>
        <supervisor name="External 002"/>
    </viva>
    <viva student="Student 006" title="Title 6" start="2024-06-02T10:30:00" end="2024-06-02T12:00:00" preference="12">
        <president name="Teacher 002"/>
        <advisor name="Teacher 003"/>
        <coadvisor name="Teacher 001"/>
        <supervisor name="External 002"/>
        <supervisor name="External 003"/>
    </viva>
</schedule>