<?xml version="1.0" encoding="UTF-8"?>
<schedule xmlns:xsi="http://www.w3.org/2001/XMLSchema-instance" xsi:noNamespaceSchemaLocation="../../schedule.xsd"
        totalPreference="45">

    <viva student="Student 004" title="Title 4" start="2024-05-30T09:00:00" end="2024-05-30T10:30:00" preference="11">
        <president name="Teacher 003"/>
        <advisor name="Teacher 001"/>
        <supervisor name="External 003"/>
    </viva>
    <viva student="Student 002" title="Title 2" start="2024-05-30T10:30:00" end="2024-05-30T12:00:00" preference="12">
        <president name="Teacher 001"/>
        <advisor name="Teacher 002"/>
        <supervisor name="External 001"/>
    </viva>
    <viva student="Student 001" title="Title 1" start="2024-05-30T14:30:00" end="2024-05-30T16:00:00" preference="9">
        <president name="Teacher 001"/>
        <advisor name="Teacher 002"/>
        <supervisor name="External 002"/>
    </viva>
    <viva student="Student 003" title="Title 3" start="2024-05-30T16:00:00" end="2024-05-30T17:30:00" preference="13">
        <president name="Teacher 001"/>
        <advisor name="Teacher 002"/>
        <supervisor name="External 001"/>
    </viva>
</schedule>
